{
  "$schema": "https://json-schema.org/draft/2020-12/schema",
  "$id": "https://project-assistant.local/meeting-card/v1.json",
  "title": "Meeting Card v1 (shared)",
  "description": "One JSON per meeting. This schema is shared with the meeting-coach companion: project-assistant uses the factual layer (context, attendees, decisions, action-card links); meeting-coach writes the reflection layer (analysis). The two never collide — they own different fields. Lives in <project>/meetings/.",
  "type": "object",
  "required": [
    "schema_version",
    "id",
    "project_id",
    "title",
    "date",
    "meeting_type",
    "purpose",
    "attendees",
    "created_at",
    "status"
  ],
  "additionalProperties": false,
  "properties": {
    "schema_version": {"type": "integer", "const": 1},
    "id": {
      "type": "string",
      "pattern": "^MTG-[A-Z]{2,10}-[A-Z]{2,7}-\\d{4}-\\d{2}-\\d{2}-\\d{2}$",
      "description": "Format: MTG-{customer_code}-{project_code}-{YYYY-MM-DD}-{NN}. NN is a 2-digit ordinal for multiple meetings on one date in the same project; otherwise 01. The {customer_code}-{project_code} portion must match the linked project-card id."
    },
    "project_id": {
      "type": "string",
      "pattern": "^[A-Z]{2,10}-[A-Z]{2,7}$",
      "description": "Reference to the project-card id."
    },
    "title": {"type": "string", "minLength": 3, "maxLength": 200},
    "date": {"type": "string", "pattern": "^\\d{4}-\\d{2}-\\d{2}$"},
    "duration_minutes": {"type": ["integer", "null"], "minimum": 1},
    "meeting_type": {
      "type": "string",
      "enum": ["kickoff", "steering", "sponsor-sync", "stakeholder-sync", "vendor-call", "1on1", "workshop", "retrospective", "decision", "escalation", "status", "other"]
    },
    "purpose": {
      "type": "string",
      "minLength": 10,
      "description": "Why did the group come together? 1-3 sentences. Hard non-empty."
    },
    "desired_outcome": {
      "type": ["string", "null"],
      "description": "What did this specific meeting need to produce or move forward? One sentence."
    },
    "attendees": {
      "type": "array",
      "minItems": 1,
      "description": "People present. When contact_id is set, the contact-card is the authoritative source; name/role/party here are convenience copies.",
      "items": {
        "type": "object",
        "required": ["name"],
        "additionalProperties": false,
        "properties": {
          "contact_id": {"type": ["string", "null"], "pattern": "^CONTACT-[A-Z]{2,10}-[a-z0-9-]+$"},
          "name": {"type": "string"},
          "role": {"type": ["string", "null"]},
          "party": {"type": ["string", "null"], "enum": ["customer", "vendor", "internal", "third-party", null]}
        }
      }
    },
    "decisions": {
      "type": "array",
      "description": "project-assistant layer. Decisions taken in the meeting. Factual record, not reflection.",
      "items": {
        "type": "object",
        "required": ["text"],
        "additionalProperties": false,
        "properties": {
          "text": {"type": "string"},
          "owner": {"type": ["string", "null"]},
          "decided_by": {"type": ["string", "null"], "description": "Who held decision authority for this one."}
        }
      }
    },
    "action_cards_created": {
      "type": "array",
      "items": {"type": "string", "pattern": "^[A-Z]{2,4}-[A-Z]{2,10}-[A-Z]{2,7}-[0-9]{4}[A-Z]?$"},
      "description": "project-assistant layer. Action-card ids spun out of this meeting. Closes the loop between a meeting and the work it generated."
    },
    "notes": {
      "type": ["string", "null"],
      "maxLength": 4000,
      "description": "project-assistant layer. Free-text factual notes or a short summary. NOT a transcript."
    },
    "user_role": {
      "type": ["string", "null"],
      "enum": ["facilitator", "co-facilitator", "participant", "observer", null]
    },
    "user_intent": {
      "type": ["string", "null"],
      "description": "meeting-coach layer. What YOU wanted to land in this meeting, written before any reflection. Required by meeting-coach before it will analyze."
    },
    "user_self_assessment": {"type": ["string", "null"], "maxLength": 1000, "description": "meeting-coach layer."},
    "transcript_provided": {"type": ["boolean", "null"], "description": "meeting-coach layer."},
    "transcript_excerpt": {"type": ["string", "null"], "maxLength": 2000, "description": "meeting-coach layer. Short excerpt for identification, NOT the full transcript."},
    "analysis": {
      "type": ["object", "null"],
      "description": "meeting-coach layer. Written by the reflection companion, not by project-assistant. See the meeting-coach schema for the full shape (strengths, growth_points, reflection_questions, pattern_read).",
      "additionalProperties": true
    },
    "user_reflections": {
      "type": "array",
      "description": "meeting-coach layer. Append-only log of the user's reasoning.",
      "items": {"type": "object", "additionalProperties": true}
    },
    "previous_meeting_card_id": {
      "type": ["string", "null"],
      "pattern": "^MTG-[A-Z]{2,10}-[A-Z]{2,7}-\\d{4}-\\d{2}-\\d{2}-\\d{2}$"
    },
    "created_at": {"type": "string", "format": "date-time"},
    "status": {
      "type": "string",
      "enum": ["logged", "analyzed", "archived"],
      "description": "logged = factual record captured by project-assistant; analyzed = meeting-coach produced reflection; archived = closed."
    }
  }
}
